{"adapter_sha256":"4dc0149fd8626e21bffec1496d946b5ccb094351bc30141e5e0c177ed7349cbc","candidate_id":"minimal-settled-set","candidate_implementation_sha256":"7e450d1725ac0d5f0d43374fa4a8ab0c9c43fe578c651bd1652789b0cebfa775","cases":[{"fixture_id":"quality-claim-evidence","input_locator":"evals/adapter-fixtures/quality-claim-evidence/input.json","input_sha256":"3bb3bf5f7b1a8c9e5718f757f2e104f9d9e54abfaf1390004cec67279644c2e2","output_frozen_at":"2026-07-28T10:04:31Z","output_locator":"compatibility/minimal-settled-set/quality-claim-evidence-output.json","output_sha256":"a6cf61a1ccbedd88feefcb06d261e605777932efd61f8f21bc7ae3ad11f5d518","result":"pass"},{"fixture_id":"lifecycle-interruption","input_locator":"evals/adapter-fixtures/lifecycle-interruption/input.json","input_sha256":"ff840bb331675f1e4a3cea8e5667b3ef9d8b57aa9a76ea32616f562d3cccd320","output_frozen_at":"2026-07-28T10:04:31Z","output_locator":"compatibility/minimal-settled-set/lifecycle-interruption-output.json","output_sha256":"8dd315087da1bb52b2f3e890cff7cc0a86015fdc05e6ed839e671d63199e46b7","result":"pass"}],"compatibility_payload_sha256":"988cc13155c13ab6975c3983a708d336a6c89f88dbb188861333f585bc4d0d1a","dispatch_input_snapshot_sha256":"1fba50916e2a98b10c3b0254b321adca27c0aa232985b47487e000361c69ed19","evaluation_report_locator":"compatibility/minimal-settled-set/evaluation-report.json","evaluation_report_sha256":"af150c9ff1a9fff4681787ed06583608d2bd39a7932741189d931c17e5916bbe","executed_at":"2026-07-28T10:04:32Z","execution_id":"exec-minimal-settled-set-20260728","execution_performed":true,"executor":{"configuration_state":"requested_and_recorded","effective_telemetry":"not_surfaced","executor_id":"executor-minimal-settled-set","requested_mode":"ultra","requested_model":"gpt-5.6-sol","resolved_mode":null,"resolved_model":null,"role":"candidate_executor"},"fixture_manifest_locator":"evals/adapter-fixtures/manifest.json","fixture_manifest_sha256":"d61c2299f9390e7cc3d714e19c5ffae55828cbf493d5eefe0ce95f5d5f509fff","fixture_set":"forward-v1","limitations":["The lifecycle state remained in memory; durable process-loss recovery was outside this candidate's demonstrated behavior.","Requested model and effort were recorded, while host-effective runtime telemetry was not surfaced."],"oracle_access_record":"declared_withheld_until_output_frozen","oracle_boundary_verification":"dispatch_snapshot_excludes_oracle","raw_output_produced":true,"receipt_kind":"adapter_candidate_execution","runner":"codex-evaluation-harness","runner_locator":"scripts/adapter_evaluation_scorer.py","runner_sha256":"dfacbc817215d02be2ac20591fb3191dcc8548d9af275dfae7f818016eb81a1f","runner_version":"1.0.0","schema_version":"1.0.0","status":"completed"}
