{"adapter_sha256":"4dc0149fd8626e21bffec1496d946b5ccb094351bc30141e5e0c177ed7349cbc","candidate_id":"persisted-task-registry","candidate_implementation_sha256":"b3c44c7d90892dc65715690c44a14ebfa6220784459e8dedf481358edad1dd31","cases":[{"fixture_id":"quality-claim-evidence","input_locator":"evals/adapter-fixtures/quality-claim-evidence/input.json","input_sha256":"3bb3bf5f7b1a8c9e5718f757f2e104f9d9e54abfaf1390004cec67279644c2e2","output_frozen_at":"2026-07-28T10:04:31Z","output_locator":"compatibility/persisted-task-registry/quality-claim-evidence-output.json","output_sha256":"2d2470249a5f3467785868c45210a1e21303369198e21658556a7ac6a76d2dba","result":"pass"},{"fixture_id":"lifecycle-interruption","input_locator":"evals/adapter-fixtures/lifecycle-interruption/input.json","input_sha256":"ff840bb331675f1e4a3cea8e5667b3ef9d8b57aa9a76ea32616f562d3cccd320","output_frozen_at":"2026-07-28T10:04:31Z","output_locator":"compatibility/persisted-task-registry/lifecycle-interruption-output.json","output_sha256":"1b9a9bb4580dc2b048f864cb4b0c2329e29e5e2696f491c5767b6b3d4ab4f137","result":"pass"}],"compatibility_payload_sha256":"988cc13155c13ab6975c3983a708d336a6c89f88dbb188861333f585bc4d0d1a","dispatch_input_snapshot_sha256":"577f8699b4a25ad6b5a1db508fb371352ec3a4991f5bc7c67cbc62eae8981a2e","evaluation_report_locator":"compatibility/persisted-task-registry/evaluation-report.json","evaluation_report_sha256":"463413284a50dea4521d0cfca9166ef1f23278abc37b2bb6f9624a73b2c60296","executed_at":"2026-07-28T10:04:32Z","execution_id":"exec-persisted-task-registry-20260728","execution_performed":true,"executor":{"configuration_state":"requested_and_recorded","effective_telemetry":"not_surfaced","executor_id":"executor-persisted-task-registry","requested_mode":"ultra","requested_model":"gpt-5.6-sol","resolved_mode":null,"resolved_model":null,"role":"candidate_executor"},"fixture_manifest_locator":"evals/adapter-fixtures/manifest.json","fixture_manifest_sha256":"d61c2299f9390e7cc3d714e19c5ffae55828cbf493d5eefe0ce95f5d5f509fff","fixture_set":"forward-v1","limitations":["The lifecycle run created, atomically replaced, reloaded, and reconciled a disk registry; the final raw-byte registry SHA-256 was 549fb1b731d63bf8f92eee3bd8b70619f826e510b4e429fdc5c9bf18a28f8bc4.","The single lifecycle stream did not cover arbitrary corruption, concurrent writers, or production-scale recovery.","Requested model and effort were recorded, while host-effective runtime telemetry was not surfaced."],"oracle_access_record":"declared_withheld_until_output_frozen","oracle_boundary_verification":"dispatch_snapshot_excludes_oracle","raw_output_produced":true,"receipt_kind":"adapter_candidate_execution","runner":"codex-evaluation-harness","runner_locator":"scripts/adapter_evaluation_scorer.py","runner_sha256":"dfacbc817215d02be2ac20591fb3191dcc8548d9af275dfae7f818016eb81a1f","runner_version":"1.0.0","schema_version":"1.0.0","status":"completed"}
